{
    "$schema": "https://json-schema.org/draft/2020-12/schema",
    "$id": "https://json-schema.org/draft/2020-12/schema",
    "title": "Core and Validation specifications meta-schema",
    "$comment": "JSON Schema 2020-12 with its vocabularies inlined and every $dynamicRef written as a local $ref: the JSON worker fetches nothing and follows no dynamic reference.",
    "type": ["object", "boolean"],
    "properties": {
        "$id": {
            "$ref": "#/$defs/uriReferenceString",
            "$comment": "Non-empty fragments not allowed.",
            "pattern": "^[^#]*#?$"
        },
        "$schema": {
            "$ref": "#/$defs/uriString"
        },
        "$ref": {
            "$ref": "#/$defs/uriReferenceString"
        },
        "$anchor": {
            "$ref": "#/$defs/anchorString"
        },
        "$dynamicRef": {
            "$ref": "#/$defs/uriReferenceString"
        },
        "$dynamicAnchor": {
            "$ref": "#/$defs/anchorString"
        },
        "$vocabulary": {
            "type": "object",
            "propertyNames": {
                "$ref": "#/$defs/uriString"
            },
            "additionalProperties": {
                "type": "boolean"
            }
        },
        "$comment": {
            "type": "string"
        },
        "$defs": {
            "type": "object",
            "additionalProperties": {
                "$ref": "#"
            }
        },
        "prefixItems": {
            "$ref": "#/$defs/schemaArray"
        },
        "items": {
            "$ref": "#"
        },
        "contains": {
            "$ref": "#"
        },
        "additionalProperties": {
            "$ref": "#"
        },
        "properties": {
            "type": "object",
            "additionalProperties": {
                "$ref": "#"
            },
            "default": {}
        },
        "patternProperties": {
            "type": "object",
            "additionalProperties": {
                "$ref": "#"
            },
            "propertyNames": {
                "format": "regex"
            },
            "default": {}
        },
        "dependentSchemas": {
            "type": "object",
            "additionalProperties": {
                "$ref": "#"
            },
            "default": {}
        },
        "propertyNames": {
            "$ref": "#"
        },
        "if": {
            "$ref": "#"
        },
        "then": {
            "$ref": "#"
        },
        "else": {
            "$ref": "#"
        },
        "allOf": {
            "$ref": "#/$defs/schemaArray"
        },
        "anyOf": {
            "$ref": "#/$defs/schemaArray"
        },
        "oneOf": {
            "$ref": "#/$defs/schemaArray"
        },
        "not": {
            "$ref": "#"
        },
        "unevaluatedItems": {
            "$ref": "#"
        },
        "unevaluatedProperties": {
            "$ref": "#"
        },
        "type": {
            "anyOf": [
                {
                    "$ref": "#/$defs/simpleTypes"
                },
                {
                    "type": "array",
                    "items": {
                        "$ref": "#/$defs/simpleTypes"
                    },
                    "minItems": 1,
                    "uniqueItems": true
                }
            ]
        },
        "const": true,
        "enum": {
            "type": "array",
            "items": true
        },
        "multipleOf": {
            "type": "number",
            "exclusiveMinimum": 0
        },
        "maximum": {
            "type": "number"
        },
        "exclusiveMaximum": {
            "type": "number"
        },
        "minimum": {
            "type": "number"
        },
        "exclusiveMinimum": {
            "type": "number"
        },
        "maxLength": {
            "$ref": "#/$defs/nonNegativeInteger"
        },
        "minLength": {
            "$ref": "#/$defs/nonNegativeIntegerDefault0"
        },
        "pattern": {
            "type": "string",
            "format": "regex"
        },
        "maxItems": {
            "$ref": "#/$defs/nonNegativeInteger"
        },
        "minItems": {
            "$ref": "#/$defs/nonNegativeIntegerDefault0"
        },
        "uniqueItems": {
            "type": "boolean",
            "default": false
        },
        "maxContains": {
            "$ref": "#/$defs/nonNegativeInteger"
        },
        "minContains": {
            "$ref": "#/$defs/nonNegativeInteger",
            "default": 1
        },
        "maxProperties": {
            "$ref": "#/$defs/nonNegativeInteger"
        },
        "minProperties": {
            "$ref": "#/$defs/nonNegativeIntegerDefault0"
        },
        "required": {
            "$ref": "#/$defs/stringArray"
        },
        "dependentRequired": {
            "type": "object",
            "additionalProperties": {
                "$ref": "#/$defs/stringArray"
            }
        },
        "title": {
            "type": "string"
        },
        "description": {
            "type": "string"
        },
        "default": true,
        "deprecated": {
            "type": "boolean",
            "default": false
        },
        "readOnly": {
            "type": "boolean",
            "default": false
        },
        "writeOnly": {
            "type": "boolean",
            "default": false
        },
        "examples": {
            "type": "array",
            "items": true
        },
        "format": {
            "type": "string"
        },
        "contentEncoding": {
            "type": "string"
        },
        "contentMediaType": {
            "type": "string"
        },
        "contentSchema": {
            "$ref": "#"
        },
        "definitions": {
            "$comment": "\"definitions\" has been replaced by \"$defs\".",
            "type": "object",
            "additionalProperties": {
                "$ref": "#"
            },
            "deprecated": true,
            "default": {}
        },
        "dependencies": {
            "$comment": "\"dependencies\" has been split and replaced by \"dependentSchemas\" and \"dependentRequired\" in order to serve their differing semantics.",
            "type": "object",
            "additionalProperties": {
                "anyOf": [
                    {
                        "$ref": "#"
                    },
                    {
                        "$ref": "#/$defs/stringArray"
                    }
                ]
            },
            "deprecated": true,
            "default": {}
        },
        "$recursiveAnchor": {
            "$comment": "\"$recursiveAnchor\" has been replaced by \"$dynamicAnchor\".",
            "$ref": "#/$defs/anchorString",
            "deprecated": true
        },
        "$recursiveRef": {
            "$comment": "\"$recursiveRef\" has been replaced by \"$dynamicRef\".",
            "$ref": "#/$defs/uriReferenceString",
            "deprecated": true
        }
    },
    "$defs": {
        "anchorString": {
            "type": "string",
            "pattern": "^[A-Za-z_][-A-Za-z0-9._]*$"
        },
        "uriString": {
            "type": "string",
            "format": "uri"
        },
        "uriReferenceString": {
            "type": "string",
            "format": "uri-reference"
        },
        "schemaArray": {
            "type": "array",
            "minItems": 1,
            "items": {
                "$ref": "#"
            }
        },
        "nonNegativeInteger": {
            "type": "integer",
            "minimum": 0
        },
        "nonNegativeIntegerDefault0": {
            "$ref": "#/$defs/nonNegativeInteger",
            "default": 0
        },
        "simpleTypes": {
            "enum": ["array", "boolean", "integer", "null", "number", "object", "string"]
        },
        "stringArray": {
            "type": "array",
            "items": {
                "type": "string"
            },
            "uniqueItems": true,
            "default": []
        }
    }
}
